{
  "product": {
    "name": "304 stainless steel insulated bottle 500ml",
    "brand": null,
    "category": {
      "value": "Home & Kitchen > Kitchen & Dining > Drinkware > Thermoses",
      "confidence": 0.6
    }
  },
  "facts": [
    {
      "id": "F1",
      "statement": "材质为304不锈钢",
      "source": "user_input",
      "evidence": "304 stainless steel"
    },
    {
      "id": "F2",
      "statement": "产品为保温瓶",
      "source": "user_input",
      "evidence": "insulated bottle"
    },
    {
      "id": "F3",
      "statement": "容量为500ml",
      "source": "user_input",
      "evidence": "500ml"
    },
    {
      "id": "F4",
      "statement": "保温12小时",
      "source": "user_input",
      "evidence": "保温12小时"
    },
    {
      "id": "F5",
      "statement": "保冷24小时",
      "source": "user_input",
      "evidence": "保冷24小时"
    },
    {
      "id": "F6",
      "statement": "BPA free",
      "source": "user_input",
      "evidence": "BPA free"
    },
    {
      "id": "F7",
      "statement": "带茶漏",
      "source": "user_input",
      "evidence": "带茶漏"
    }
  ],
  "attributes": [
    {
      "name": "材质",
      "value": "304不锈钢",
      "fact_ids": [
        "F1"
      ]
    },
    {
      "name": "产品类型",
      "value": "保温瓶",
      "fact_ids": [
        "F2"
      ]
    },
    {
      "name": "容量",
      "value": "500ml",
      "fact_ids": [
        "F3"
      ]
    },
    {
      "name": "保温时长",
      "value": "12小时",
      "fact_ids": [
        "F4"
      ]
    },
    {
      "name": "保冷时长",
      "value": "24小时",
      "fact_ids": [
        "F5"
      ]
    },
    {
      "name": "BPA free",
      "value": "是",
      "fact_ids": [
        "F6"
      ]
    },
    {
      "name": "配件",
      "value": "茶漏",
      "fact_ids": [
        "F7"
      ]
    }
  ],
  "forbidden_claims": [
    {
      "claim": "World's best insulation!!",
      "reason": "夸大宣传，无法验证"
    },
    {
      "claim": "BPA free",
      "reason": "输入未提供检测或认证依据"
    },
    {
      "claim": "保温12小时",
      "reason": "输入未提供检测或认证依据"
    },
    {
      "claim": "保冷24小时",
      "reason": "输入未提供检测或认证依据"
    }
  ],
  "unknowns": [
    {
      "field": "尺寸",
      "why_needed": "买家需要知道产品尺寸以判断是否适合使用场景"
    },
    {
      "field": "重量",
      "why_needed": "买家需要知道重量以判断便携性"
    },
    {
      "field": "颜色",
      "why_needed": "买家需要知道颜色以选择偏好"
    },
    {
      "field": "适用型号",
      "why_needed": "买家需要知道是否适配自己的设备或使用场景"
    },
    {
      "field": "清洗方式",
      "why_needed": "买家需要知道如何清洗和维护"
    },
    {
      "field": "认证与检测证明（如CE、FCC、FDA、检测报告）",
      "why_needed": "买家需要确认产品符合安全与质量标准"
    }
  ]
}