{
  "product": {
    "name": "iPhone 15 Pro 手机壳",
    "brand": null,
    "category": {
      "value": "Consumer Electronics > Mobile Phone Accessories > Phone Cases",
      "confidence": 0.9
    }
  },
  "facts": [
    {
      "id": "F1",
      "statement": "适用机型为 iPhone 15 Pro",
      "source": "user_input",
      "evidence": "iPhone 15 Pro 手机壳"
    },
    {
      "id": "F2",
      "statement": "材质为 TPU+PC 双层",
      "source": "user_input",
      "evidence": "TPU+PC双层"
    },
    {
      "id": "F3",
      "statement": "防摔高度为 1.5 米",
      "source": "user_input",
      "evidence": "防摔1.5米"
    },
    {
      "id": "F4",
      "statement": "兼容磁吸 MagSafe",
      "source": "user_input",
      "evidence": "磁吸MagSafe兼容"
    }
  ],
  "attributes": [
    {
      "name": "适用机型",
      "value": "iPhone 15 Pro",
      "fact_ids": [
        "F1"
      ]
    },
    {
      "name": "材质",
      "value": "TPU+PC双层",
      "fact_ids": [
        "F2"
      ]
    },
    {
      "name": "防摔高度",
      "value": "1.5米",
      "fact_ids": [
        "F3"
      ]
    },
    {
      "name": "磁吸兼容",
      "value": "MagSafe兼容",
      "fact_ids": [
        "F4"
      ]
    }
  ],
  "forbidden_claims": [
    {
      "claim": "军规级防摔",
      "reason": "夸大宣传，输入未提供任何军规测试标准或认证依据"
    },
    {
      "claim": "通过军规防摔认证",
      "reason": "输入未提供"
    },
    {
      "claim": "防水等级（如 IP68）",
      "reason": "输入未提供"
    },
    {
      "claim": "附带检测报告",
      "reason": "输入未提供"
    }
  ],
  "unknowns": [
    {
      "field": "尺寸（长宽厚）",
      "why_needed": "买家需要确认是否贴合手机、是否影响握持和无线充电"
    },
    {
      "field": "重量",
      "why_needed": "买家关心便携性和手感"
    },
    {
      "field": "颜色/外观选项",
      "why_needed": "买家需要选择符合个人喜好的款式"
    },
    {
      "field": "认证与检测证明（如 CE、FCC、RoHS、防摔检测报告）",
      "why_needed": "买家关心产品安全合规，也是平台合规要求"
    },
    {
      "field": "清洗方式",
      "why_needed": "买家需要知道如何清洁保养"
    },
    {
      "field": "保修期限",
      "why_needed": "买家关心售后保障"
    }
  ]
}