{
  "product": {
    "name": "维生素D3+K2软胶囊",
    "brand": null,
    "category": {
      "value": "Health & Household > Vitamins & Dietary Supplements > Vitamins",
      "confidence": 0.6
    }
  },
  "facts": [
    {
      "id": "F1",
      "statement": "产品为维生素D3+K2软胶囊。",
      "source": "user_input",
      "evidence": "维生素D3+K2软胶囊"
    },
    {
      "id": "F2",
      "statement": "产品为60粒装。",
      "source": "user_input",
      "evidence": "60粒装"
    },
    {
      "id": "F3",
      "statement": "每粒含维生素D3 2000IU。",
      "source": "user_input",
      "evidence": "每粒含维生素D3 2000IU"
    },
    {
      "id": "F4",
      "statement": "产品无糖。",
      "source": "user_input",
      "evidence": "无糖"
    }
  ],
  "attributes": [
    {
      "name": "产品类型",
      "value": "软胶囊",
      "fact_ids": [
        "F1"
      ]
    },
    {
      "name": "主要成分",
      "value": "维生素D3、K2",
      "fact_ids": [
        "F1"
      ]
    },
    {
      "name": "规格",
      "value": "60粒装",
      "fact_ids": [
        "F2"
      ]
    },
    {
      "name": "每粒维生素D3含量",
      "value": "2000IU",
      "fact_ids": [
        "F3"
      ]
    },
    {
      "name": "糖分",
      "value": "无糖",
      "fact_ids": [
        "F4"
      ]
    }
  ],
  "forbidden_claims": [
    {
      "claim": "补钙好帮手",
      "reason": "输入未提供作用机制、检测或认证依据，属功效声称。"
    },
    {
      "claim": "有助改善骨质疏松",
      "reason": "涉及疾病/健康功效，输入未提供医学或临床依据，属疾病功效声称。"
    },
    {
      "claim": "增强免疫力",
      "reason": "健康功效声称，输入未提供检测、认证或医学依据。"
    },
    {
      "claim": "FDA认证/注册",
      "reason": "输入未提供"
    },
    {
      "claim": "GMP认证",
      "reason": "输入未提供"
    },
    {
      "claim": "第三方检测报告",
      "reason": "输入未提供"
    },
    {
      "claim": "蓝帽子保健食品认证",
      "reason": "输入未提供"
    }
  ],
  "unknowns": [
    {
      "field": "维生素K2含量及形式（如MK-4、MK-7）",
      "why_needed": "输入只写了含K2，未说明具体含量和形式，买家需要据此判断配方。"
    },
    {
      "field": "适用人群与年龄限制",
      "why_needed": "膳食补充剂通常需要明确适用人群和禁忌，输入未提供。"
    },
    {
      "field": "建议服用方法/每日剂量",
      "why_needed": "买家需要知道如何服用，输入未提供。"
    },
    {
      "field": "品牌/生产商/产地",
      "why_needed": "买家需要了解品牌和来源，输入未提供。"
    },
    {
      "field": "认证与检测证明（如 FDA、GMP、第三方检测报告、无糖检测报告）",
      "why_needed": "输入未提供认证或检测依据，无法核实质量与合规性。"
    },
    {
      "field": "保质期与储存条件",
      "why_needed": "买家需要知道保存方式和有效期，输入未提供。"
    }
  ]
}