{
  "product": {
    "name": "瑜伽垫",
    "brand": null,
    "category": {
      "value": "Sports & Outdoors > Yoga & Pilates > Yoga Mats",
      "confidence": 0.95
    }
  },
  "facts": [
    {
      "id": "F1",
      "statement": "产品是瑜伽垫",
      "source": "user_input",
      "evidence": "瑜伽垫"
    },
    {
      "id": "F2",
      "statement": "材质是 TPE",
      "source": "user_input",
      "evidence": "TPE材质"
    },
    {
      "id": "F3",
      "statement": "尺寸是 183x61cm",
      "source": "user_input",
      "evidence": "183x61cm"
    },
    {
      "id": "F4",
      "statement": "厚度是 6mm",
      "source": "user_input",
      "evidence": "厚6mm"
    },
    {
      "id": "F5",
      "statement": "表面有防滑纹理",
      "source": "user_input",
      "evidence": "防滑纹理"
    }
  ],
  "attributes": [
    {
      "name": "产品类型",
      "value": "瑜伽垫",
      "fact_ids": [
        "F1"
      ]
    },
    {
      "name": "材质",
      "value": "TPE",
      "fact_ids": [
        "F2"
      ]
    },
    {
      "name": "尺寸",
      "value": "183x61cm",
      "fact_ids": [
        "F3"
      ]
    },
    {
      "name": "厚度",
      "value": "6mm",
      "fact_ids": [
        "F4"
      ]
    },
    {
      "name": "表面设计",
      "value": "防滑纹理",
      "fact_ids": [
        "F5"
      ]
    }
  ],
  "forbidden_claims": [
    {
      "claim": "无毒无味",
      "reason": "模糊且绝对化的安全声称，缺乏检测依据，不能作为事实"
    },
    {
      "claim": "绝对环保",
      "reason": "绝对化环保声称，缺乏认证或检测依据，不能作为事实"
    },
    {
      "claim": "具有 CE、SGS、REACH 等认证或检测报告",
      "reason": "输入未提供"
    },
    {
      "claim": "具有防水或防滑等级（如 IPX、摩擦系数）",
      "reason": "输入未提供"
    }
  ],
  "unknowns": [
    {
      "field": "颜色/花色",
      "why_needed": "买家需要知道外观选择，输入未提供"
    },
    {
      "field": "产品重量",
      "why_needed": "影响携带与运输成本，输入未提供"
    },
    {
      "field": "清洗与保养方式",
      "why_needed": "买家需要正确维护产品，输入未提供"
    },
    {
      "field": "包装清单/配件（如背带、收纳袋）",
      "why_needed": "影响使用便利性，输入未提供"
    },
    {
      "field": "认证或检测报告（如 SGS、REACH、RoHS 等）",
      "why_needed": "用于支撑材质安全与环保声称，输入未提供"
    },
    {
      "field": "保修/售后政策",
      "why_needed": "影响购买决策与售后保障，输入未提供"
    }
  ]
}