{
  "product": {
    "name": "Automatic pet feeder 4L",
    "brand": null,
    "category": {
      "value": "Pet Supplies > Feeding & Watering Supplies > Automatic Feeders",
      "confidence": 0.9
    }
  },
  "facts": [
    {
      "id": "F1",
      "statement": "Automatic pet feeder 容量为4L。",
      "source": "user_input",
      "evidence": "Automatic pet feeder 4L"
    },
    {
      "id": "F2",
      "statement": "Timer feeding 最多每天6餐。",
      "source": "user_input",
      "evidence": "timer feeding up to 6 meals/day"
    },
    {
      "id": "F3",
      "statement": "Dual power，支持电池和USB。",
      "source": "user_input",
      "evidence": "dual power (battery + USB)"
    },
    {
      "id": "F4",
      "statement": "配有stainless steel bowl。",
      "source": "user_input",
      "evidence": "stainless steel bowl"
    },
    {
      "id": "F5",
      "statement": "支持APP控制。",
      "source": "user_input",
      "evidence": "APP控制"
    }
  ],
  "attributes": [
    {
      "name": "capacity",
      "value": "4L",
      "fact_ids": [
        "F1"
      ]
    },
    {
      "name": "feeding_schedule",
      "value": "timer feeding up to 6 meals/day",
      "fact_ids": [
        "F2"
      ]
    },
    {
      "name": "power_source",
      "value": "dual power (battery + USB)",
      "fact_ids": [
        "F3"
      ]
    },
    {
      "name": "bowl_material",
      "value": "stainless steel",
      "fact_ids": [
        "F4"
      ]
    },
    {
      "name": "control",
      "value": "APP控制",
      "fact_ids": [
        "F5"
      ]
    }
  ],
  "forbidden_claims": [
    {
      "claim": "CE/FCC/FDA认证",
      "reason": "输入未提供"
    },
    {
      "claim": "防水等级/IPX防水",
      "reason": "输入未提供"
    },
    {
      "claim": "无毒无害/食品级/不含BPA",
      "reason": "输入未提供"
    },
    {
      "claim": "静音/超静音",
      "reason": "输入未提供"
    }
  ],
  "unknowns": [
    {
      "field": "产品尺寸与重量",
      "why_needed": "买家需要判断摆放空间和运输成本，输入未提供"
    },
    {
      "field": "颜色和外观",
      "why_needed": "影响购买决策，输入未提供"
    },
    {
      "field": "适用宠物类型与喂食量",
      "why_needed": "4L容量和6餐/天需匹配宠物大小与每餐份量，输入未提供"
    },
    {
      "field": "电池类型/USB规格/是否含电源适配器",
      "why_needed": "dual power 但缺少电池型号、USB接口和适配器信息，影响使用与采购"
    },
    {
      "field": "不锈钢碗是否可拆卸及清洗方式",
      "why_needed": "影响日常清洁与卫生，输入未提供"
    },
    {
      "field": "认证与检测报告（如 CE、FCC、FDA、材料检测）",
      "why_needed": "平台合规和买家信任需要，输入未提供"
    }
  ]
}